{"$schema":"http://json-schema.org/draft-07/schema#","title":"machine-verdict.v1","type":"object","additionalProperties":false,"required":["schema","work_id","attempt","content_digest","checks","pass","verified_at"],"properties":{"schema":{"const":"machine-verdict.v1"},"work_id":{"type":"string","pattern":"^[0-9a-f]{64}$"},"attempt":{"type":"integer","minimum":1},"content_digest":{"type":"string","pattern":"^[0-9a-f]{64}$"},"checks":{"type":"array","items":{"type":"object","additionalProperties":false,"required":["name","cmd","exit_code","pass","output_digest"],"properties":{"name":{"type":"string"},"cmd":{"type":"string"},"exit_code":{"type":"integer"},"pass":{"type":"boolean"},"output_digest":{"type":"string","pattern":"^[0-9a-f]{64}$"}}}},"pass":{"type":"boolean"},"verified_at":{"type":"string","pattern":"^\\d{4}-\\d{2}-\\d{2}T[^ ]+Z$","format":"date-time"}}}
