{"schema":"machine-verdict.v1","work_id":"aaaaaaaaaaaaaaaaaaaaaaaaaaaaaaaaaaaaaaaaaaaaaaaaaaaaaaaaaaaaaaaa","attempt":1,"content_digest":"bbbbbbbbbbbbbbbbbbbbbbbbbbbbbbbbbbbbbbbbbbbbbbbbbbbbbbbbbbbbbbbb","checks":[{"name":"t","cmd":"true","exit_code":0,"pass":true,"output_digest":"cccccccccccccccccccccccccccccccccccccccccccccccccccccccccccccccc"}],"pass":true,"verified_at":"2026-01-01T00:00:00Z"}
